{
  "$schema": "../schema/_choiceset.schema.json",
  "kind": "global-choice-set",
  "logicalName": "cr1bd_inspectionlocationpolicy",
  "displayName": "Inspection Location Policy",
  "description": "WorkProvider.inspectionLocationPolicy — the binding enum (inspection-address.md + provider-corpus.md). Drives the M1 address policy gate. `prefer_address` is the default for UNKNOWN providers. NOTE: this REPLACES the stale prototype Provider enum ('physical'|'image_based'|'mixed', mock/types.ts ~line 199) which is to be updated to this set in Phase 1 (§5.10 / Risk #6). No path may yield 'Image Based Assessment' without an explicit reviewer decision + reason.",
  "isGlobal": true,
  "default": "prefer_address",
  "options": [
    { "value": 100000000, "name": "always_image_based", "label": "Always Image Based" },
    { "value": 100000001, "name": "prefer_address",     "label": "Prefer Address" },
    { "value": 100000002, "name": "required_address",   "label": "Required Address" }
  ]
}
