{
  "$schema": "../schema/_choiceset.schema.json",
  "kind": "global-choice-set",
  "logicalName": "cr1bd_intakechannelkind",
  "displayName": "Intake Channel Kind",
  "description": "Case.intakeChannelKind — how an item arrived. Audatex is OUT OF SCOPE. WhatsApp intake is manual (ADR-0007). Channel MODE (auto|manual) is a separate boolean column (cr1bd_intakechannelmanual) on the Case table.",
  "isGlobal": true,
  "options": [
    { "value": 100000000, "name": "email",        "label": "Email" },
    { "value": 100000001, "name": "whatsapp",     "label": "WhatsApp" },
    { "value": 100000002, "name": "provider_api", "label": "Provider API" },
    { "value": 100000003, "name": "retro",        "label": "Retro (reconstructed)" }
  ]
}
