{
  "$schema": "../schema/_choiceset.schema.json",
  "kind": "global-choice-set",
  "logicalName": "cr1bd_actionreason",
  "displayName": "Action Reason",
  "description": "Case.actionReason — why a PERSON must act on a case (needs-action cases only; null otherwise). Matches the prototype ActionReason union (mock/types.ts) 1:1. Stored (not derived) per Phase-1 Risk #9 so the dashboard facet chips + aging tallies can group server-side.",
  "isGlobal": true,
  "options": [
    { "value": 100000000, "name": "missing_images",       "label": "Missing Images" },
    { "value": 100000001, "name": "missing_instructions", "label": "Missing Instructions" },
    { "value": 100000002, "name": "duplicate",            "label": "Duplicate" },
    { "value": 100000003, "name": "conflict",             "label": "Conflict" },
    { "value": 100000004, "name": "needs_review",         "label": "Needs Review" }
  ]
}
