{
  "$schema": "../schema/_choiceset.schema.json",
  "kind": "global-choice-set",
  "logicalName": "cr1bd_casestatus",
  "displayName": "Case Status",
  "description": "The Case workflow state machine. Reconciled 1:1 against the prototype CaseStatus union (mockup-app/src/mock/types.ts) and data-model.md §'Case status state machine'. The Vitest parity test asserts these labels equal the contracts' CaseStatus union exactly. Order of `value` integers follows the canonical pipeline + branch ordering; integer values are stable identifiers and MUST NOT be renumbered once deployed.",
  "isGlobal": true,
  "parityKey": "value",
  "options": [
    { "value": 100000000, "name": "new_email",                "label": "New Email" },
    { "value": 100000001, "name": "ingested",                 "label": "Ingested" },
    { "value": 100000002, "name": "needs_review",             "label": "Needs Review" },
    { "value": 100000003, "name": "missing_required_fields",  "label": "Missing Required Fields" },
    { "value": 100000004, "name": "missing_images",           "label": "Missing Images" },
    { "value": 100000005, "name": "duplicate_risk",           "label": "Duplicate Risk" },
    { "value": 100000006, "name": "linked_to_instruction",    "label": "Linked to Instruction" },
    { "value": 100000007, "name": "ready_for_eva",            "label": "Ready for EVA" },
    { "value": 100000008, "name": "eva_submitted",            "label": "EVA Submitted" },
    { "value": 100000009, "name": "box_synced",               "label": "Box Synced" },
    { "value": 100000010, "name": "error",                    "label": "Error" }
  ],
  "stateMachine": {
    "linear": ["new_email", "ingested", "needs_review", "ready_for_eva", "eva_submitted", "box_synced"],
    "branches": ["missing_required_fields", "missing_images", "duplicate_risk", "linked_to_instruction"],
    "terminals": ["eva_submitted", "box_synced", "error"]
  }
}
