{
  "$schema": "../schema/_choiceset.schema.json",
  "kind": "global-choice-set",
  "logicalName": "cr1bd_inspectiondecisionmode",
  "displayName": "Inspection Decision Mode",
  "description": "InspectionAddress.decisionMode (and Case.inspectionDecision mirror) — how the inspection location was decided. `image_based` ALWAYS requires an explicit reviewer decision + reason (never a silent pass); enforced in the M1 policy gate (§5.9).",
  "isGlobal": true,
  "default": "unknown",
  "options": [
    { "value": 100000000, "name": "confirmed_physical", "label": "Confirmed Physical" },
    { "value": 100000001, "name": "manual",             "label": "Manual" },
    { "value": 100000002, "name": "image_based",        "label": "Image Based" },
    { "value": 100000003, "name": "unknown",            "label": "Unknown" }
  ]
}
